"263,Manitou,""['Area Majority / Influence', 'Hand Management', 'Open Drafting', 'Rock-Paper-Scissors']"",['Card Game'],It is time for the buffalo hunt.  Each player displays the hunters and great warriors of his tribe which make up his hunting party.  Great warriors can capture opponents' tribesmen and score points for you.  Strong hunters can win buffalo for the tribe.  Whoever plays his cards with the greatest skill over the three hunts wins the game.<br/><br/>Part of the Goldsieber à la Carte line of games.<br/><br/>Re-implemented as:<br/><br/><br/>     Big Manitou<br/><br/><br/>,1997,,,";;;;;;;;;;;;;;;;;;;;;;;;;;;;;;;;;;;;;;;;;;;;;;;;;;;;
"264,Enemy in Sight,""['Dice Rolling', 'Hand Management', 'Take That']"",""['Age of Reason', 'American Revolutionary War', 'Card Game', 'Napoleonic', 'Nautical', 'Wargame']"",""Enemy in Sight, originally called Cutthroats and Cannons, was two years in the making.<br/><br/>It is a fast paced card wargame with a good mix of strategy and luck of the draw.<br/><br/>Each player starts with a fleet of six ships and six cards. As your ships are destroyed your hand size diminishes as well.<br/><br/>One of the most unique characteristics of the game is the walking disasters. The red cards in EIS move around the table from player to player until resolved.<br/><br/>"",1988,,,";;;;;;;;;;;;;;;;;;;;;;;;;;;;;;;;;;;;;;;;;;;;;;;;;;;;
"265,Intrige,""['Area Majority / Influence', 'Auction/Bidding', 'Bribery', 'Hand Management', 'Negotiation']"",""['Negotiation', 'Renaissance']"",""This pure negotiation game pits the players as Renaissance era families that are engaging in rampant nepotism.  Players are seeking positions in the other families' businesses, and to further that pursuit players offer bribes.  However, once accepting a bribe, the 'bought' player is under absolutely no obligation to honor the highest briber or any other verbal deal.  In a word, this game is vicious.<br/><br/>The new AMIGO edition came out in 2005.<br/><br/>The main difference between the F.X. Schmid and the AMIGO versions are that the the F.X. Schmid version uses five houses/buildings per player, with values of 1,2,3,5, and 10, but the AMIGO version uses four buildings/houses per player, with values of 1,3,6, and 10.  Accordingly, the F.X. Schmid version has five professions - knight, merchant, lawyer, writer, and clergy - but the AMIGO version retains only clergy and writer, and adds chemist and doctor.<br/><br/>"",1994,,,";;;;;;;;;;;;;;;;;;;;;;;;;;;;;;;;;;;;;;;;;;;;;;;;;;;;
266,,[],[],,,,,;;;;;;;;;;;;;;;;;;;;;;;;;;;;;;;;;;;;;;;;;;;;;;;;;;;;
"267,Tycoon,""['Area Majority / Influence', 'Point to Point Movement']"",['Economic'],""In Tycoon, players are businessmen traveling around the world, doing what businessmen do: making money.  In this case, business is defined as opening hotels and factories in major cities, like Sydney, Cairo, and New York.<br/><br/>Players are seeking to build hotels in as many cities as possible while also building the first or second most hotels in given cites to earn money, which is also your score. Additional money can be earned by building factories in each city, but these are limited in number.<br/><br/>During the course of the game players will take turns buying and/or using plane tickets to move about the board's nine cities. A number of tickets are displayed in rows, divided into two types: The more expensive scheduled flights which allow you to move directly to the printed city, or move your token a number of city spaces orthogonally on the board. Cheaper charter flights allow movement directly between the two city spaces printed on the ticket. You may buy tickets at any time during your turn, and you are not required to move but must do so before taking any regular actions; you may also use any many tickets in a turn as you wish.<br/><br/>The regular actions include building hotels and factories. Hotels are built on a u-shaped track. When a hotel is built on a red space the building that is oldest/furthest back on the track is removed. Players with the first and second most hotels on the track will be the only ones to score, with ties broken by the player with the earliest bulding on the track. There are only two factory spaces per city, and they will score points equal to the second place of the hotel scoring. In lieu of any actions or flying, or if you simply have no money, you may also take out loans; this removes your token from the board and forces you to use the more costly scheduled flights to return to the board.<br/><br/>At the start of the game players are given all of their factories. Each round players are given a set number of hotels in addition to any they have left over from the previous round. When any player has built all of the hotels in front of them a scoring occurs. After three scorings the game ends and the player with the most money is the winner.<br/><br/>"",1998,,,";;;;;;;;;;;;;;;;;;;;;;;;;;;;;;;;;;;;;;;;;;;;;;;;;;;;
"268,Cheops,""['Commodity Speculation', 'Set Collection', 'Tile Placement']"",['Ancient'],""This game revolves around using your family members to steal scarabs from a pyramid and selling them to make a profit.  Players can choose whether to sell scarabs immediately, or put them in their warehouse to sell at the end of the game for potentially higher profit.  Various laws and price boards influence the price of the scarabs up until the end of the game.<br/><br/>"",1998,,,";;;;;;;;;;;;;;;;;;;;;;;;;;;;;;;;;;;;;;;;;;;;;;;;;;;;
269,,[],[],,,,,;;;;;;;;;;;;;;;;;;;;;;;;;;;;;;;;;;;;;;;;;;;;;;;;;;;;
"270,Svea Rike,""['Area Majority / Influence', 'End Game Bonuses', 'Events', 'Open Drafting', 'Set Collection', 'Simulation', 'Take That']"",""['Civilization', 'Economic']"",""From user review:<br/><br/>The game is designed to re-create the history of Sweden from 1523 (the reign of Gustav Vasa) to 1818 (Karl XIII). Each player represent one of five noble families attempting to build status for their family. Status is achieved by accumulating fiefs, money, history cards in sets (which include such things as Queens, scientists, cultural personalities, palaces, commanders, etc.), troops and merchants.<br/><br/>The game is driven by event cards ... and there are a ton of 'em. On a turn, a player draws an event card and can play as many of them as he sees fit (whether during his turn or not). Thus, the game becomes a series of various events, usually aiding the player and/or hurting his opponents in some fashion.<br/><br/><br/>Expanded by:<br/><br/>    Svea Rike: Batalj<br/><br/><br/><br/>Note:<br/>The game was first published by Casper in 1996, and after their demise by Användbart Litet Företag (ALF) in the early 2000s.<br/><br/>"",1996,,,";;;;;;;;;;;;;;;;;;;;;;;;;;;;;;;;;;;;;;;;;;;;;;;;;;;;
"271,Bzzz… PLASK!,""['Memory', 'Set Collection']"",""['Card Game', 'Real-time']"",""It's this simple - watch the cards the dealer lays down. When you like what you see, hit the &quot;It's Mine!&quot; board and grab them all. The catch? Somebody else may want the same cards you do. The first one to slam the board claims the cards. Most cards are good, but some aren't. &quot;Double or Nothing&quot; cards only count if you claim a pair of them. &quot;Toast or Most&quot; cards only score if you have the most of them, and &quot;Jackpot&quot; cards score jackpot points depending on how many you get. IT'S MINE! is great fun for Ages 7 and up. Kids are quick - so adults be on your toes!<br/><br/>&mdash;description from the publisher<br/><br/>"",1998,,,";;;;;;;;;;;;;;;;;;;;;;;;;;;;;;;;;;;;;;;;;;;;;;;;;;;;
"272,Downtown,""['Simultaneous Action Selection', 'Tile Placement', 'Voting']"",""['City Building', 'Negotiation']"",""Taking a fairly common theme, this game is about building three types of neighborhoods in a developing city.  Each turn one or two blocks will get zoned, based on the players' votes.  Once all four properties in a block have been bought and the block has been zoned, its base score is the number of completed blocks adjoining it.  However, there are serious multipliers (positive and negative) for locating certain types of developments next to each other.<br/><br/>1st Place 1996 Hippodice Spieleautorenwettbewerb (as Boomtown).<br/><br/>"",1996,,,";;;;;;;;;;;;;;;;;;;;;;;;;;;;;;;;;;;;;;;;;;;;;;;;;;;;
"273,Africa 1880,""['Area Majority / Influence', 'Area Movement', 'Player Elimination', 'Simultaneous Action Selection']"",""['Bluffing', 'Exploration', 'Negotiation', 'Political', 'Post-Napoleonic', 'Wargame']"",""Africa 1880 -- Relive the Colonial adventure with Africa 1880! Between 1880 and 1914 European nations fiercely raced to gain control of the Dark Continent. Each player represents a nation exploring and colonizing Africa. The success of their adventure, however, has more to do with intrigue in the luxurious parlors of the embassies than hacking away through the jungle. Negotiating alliances and declaring war are what change the face of the world!&rdquo; Contains 22 resin-cast miniatures, 180 die-cut counters, one game board representing Africa, one rule book in English and French, and order sheets<br/><br/>"",1997,,,";;;;;;;;;;;;;;;;;;;;;;;;;;;;;;;;;;;;;;;;;;;;;;;;;;;;
"274,Guerilla,""['Dice Rolling', 'Hand Management', 'Hidden Roles', 'Open Drafting', 'Simulation', 'Variable Player Powers']"",""['Card Game', 'Civil War', 'Modern Warfare', 'Political', 'Wargame']"",""Guerilla is a multi-player simulation card-wargame. Three to six players vie for control of the government as rebels wage a civil war against those in power. As in real guerrilla warfare, the government forces are handicapped by their inability to separate friend from foe. This &quot;fog of war&quot; is accomplished by a clever dichotomy of goals wherein each player simultaneously commands both government and rebel forces. However, each player is secretly backing either the government of rebel cause and is severely penalized if his &quot;side&quot; doesn't win the hand.<br/><br/>Consequently, players are always torn between scoring for their &quot;side&quot;, or for themselves, or even sacrificing their own resources for the sake of an opponent who appears to be on their side. But is he? Even when you think you've figured out who is who, the Revolution card can appear to change loyalties and totally cloud the issue again.<br/><br/>Players score by eliminating opposing forces, manipulating the media and world opinion, or controlling various installations such as the Port or Airfield which grant special abilities to those who hold them. Government air power and armor columns struggle against ambushing guerrilla bands which fade back into the jungle without a trace. If atrocities are committed, the U.N. may intervene and attempt to stop the open warfare. Then the battle is fought by secret police who ferret out traitors while propaganda battles are waged for the hearts and minds of the populace. Assassins abound as influential leaders are targeted in an attempt to paralyze opposing troops in preparation for the day when the U.N. withdraws.<br/><br/>Game length is variable and selected at outset. A game can comprise a single hand or be combined into three or more - resulting in a game from one to four hours in duration.<br/><br/>"",1994,,,";;;;;;;;;;;;;;;;;;;;;;;;;;;;;;;;;;;;;;;;;;;;;;;;;;;;
"275,Extinction,""['Contracts', 'Events', 'Hand Management', 'Set Collection', 'Tags', 'Take That']"",['Prehistoric'],""&quot;The Last Game They Ever Played&quot;<br/><br/>Extinction is a card game for 2-6 players, Ages 12 and up. The object of the game is to create large herds of dinosaurs while making your opponent's dino herds extinct.<br/><br/>The game is played over 3 rounds, representing the Triassic, Jurassic, and Cretaceous periods. During each round, players can meld herds of herbivorous dinos to earn points at the end of the round, play egg cards in hopes of adding to an established herd later in the game. There are several calamity cards that can be drawn, or played by another player, to throw a wrench into a player's plans. Some of these include meat-eating dinosaurs, egg-eating cards and gene pool disasters.<br/><br/>The larger your herds, and the more herds featuring different types of dinos, the more points you can earn at the end of each period. The player with the most points after the Cretaceous period is the winner!<br/><br/>"",1993,,,";;;;;;;;;;;;;;;;;;;;;;;;;;;;;;;;;;;;;;;;;;;;;;;;;;;;
"276,""La Guerre de l'Empereur: The Emperor's War, 1805-1815"",""['Area-Impulse', 'Simulation', 'Variable Player Powers']"",""['Economic', 'Napoleonic', 'Negotiation', 'Wargame']"",""La Guerre de l'Empereur: The Emperor's War, 1805-1815 is a game of maneuver and battle between the forces under Napoleon Bonaparte and six other nations that both opposed and supported him at various times in the years between 1805 and 1815. Players vie for dominance of early 19th Century Europe. As the French player, you'll set Napoleon and his armies upon a continent whose differing political statures plays right into your hands. The greatest army in Europe is at your hands...<br/><br/>Divide and conquer! As the British player, you'll utilize diplomacy, clever event play, a powerhouse economy and the greatest navy in the world to become the dominant nation. As Russia, Austria, Prussia, Spain or the Ottoman Empire, you must strike a balance between expansionist aggression and diplomatic harmony among your neighbors. Indeed, a nation must expand to triumph. However the means chosen to that end will largely decide the level of success. Play  the part of being everyone's friend and your nation will likely live in relative safety...and lose the game miserably. Play the part of the blind aggressor and you'll likely go down faster than the peace broker. Striking a balance is critical.<br/><br/>The game map covers the territories from Scandinavia in the north to the Mediterranean and North Africa in the south, and from deep Russia in the east to Portugal and the Atlantic in the west. Movement is by areas (provinces) on land, and sea zones at sea. On land, the units of maneuver are (roughly) corps, while at sea each unit represents a naval squadron. When opposing land armies meet for battle, corps are broken down into divisions (loosely) and deployed on a eight zone battle map for combat resolution. The dice-less combat engine uses a system of battle options which are played and cross-referenced for resolution of actual casualties and morale loss. The number of battle options distributed, along with the initial army morale of the opposing sides, is determined by army size, nationality and leaders present. The battle options are of offensive and defensive nature. The offensive options cover standard maneuvers such as &quot;Flank Attack&quot;, &quot;Cavalry Charge&quot; and &quot;Assault&quot;, while the defensive options are things such as &quot;Refuse Flanks&quot;, &quot;Squares Formed&quot; and &quot;Reverse Slopes&quot;.<br/><br/>The rules are relatively simple and fast moving, even though a host of subtleties and complexities of the Napoleonic period are represented within the game system. The means by which this relative simplicity was achieved was (largely) through the use of self-explanatory strategic event charts. Be warned: This game is easy to understand and play, but very difficult to master.<br/><br/>The game system works the same whether you're playing with two players or seven. With multiple players, you'll need all of your diplomacy skills to enlist aid in achieving your goals. With fewer players, the event charts will handle the bulk of the diplomatic duties. Regardless of how many players you have, all seven major powers will actively participate to a greater or lesser degree.<br/><br/>"",1997,,,";;;;;;;;;;;;;;;;;;;;;;;;;;;;;;;;;;;;;;;;;;;;;;;;;;;;
"277,Res Publica,""['Set Collection', 'Trading']"",""['Card Game', 'Civilization']"",""In Res Publica you are the will of the people, guiding five ancient civilizations to greater heights of power and technology.<br/><br/>Each turn, the active player makes a trade offer... and each player in turn responds in kind. Using the cards and the information gained through the trading process, players work to acquire five identical people cards in order to build a city (which increases the number of cards you can draw each turn) or five identical technology cards in order to build a monument (which garners end game victory points).<br/><br/>At the end of the game, players total the points achieved via cities and monuments and the one who has the most wins.<br/><br/>"",1991,,,";;;;;;;;;;;;;;;;;;;;;;;;;;;;;;;;;;;;;;;;;;;;;;;;;;;;
"278,Catan Card Game,""['Dice Rolling', 'Hand Management', 'Open Drafting', 'Trading']"",""['Card Game', 'City Building', 'Territory Building']"",""Catan Card Game bears only a slight resemblance to The Settlers of Catan, the original game in the Catan series.  There are six resources: wool, wood, bricks, grain, ore, and gold. Before beginning the game, the players receive six square cards showing the resources, with a different die number on each card. In addition, the players start the game with two village cards and a road card connecting them. There are card stacks of more roads and villages, as well as cities, to be purchased during the game. With each new village or city comes two new resource cards. Villages and cities give victory points.<br/><br/>When the number die is rolled, instead of collecting more cards, the players rotate the corresponding card 90 degrees to indicate a gain of one more of that resource; i.e., the brick card shows a picture of one brick on one edge of the card, two bricks on the next clockwise edge, three bricks along the third edge, and zero bricks on the fourth edge. There is also an event die, with five possible outcomes:<br/><br/><br/>     a reward for the player with more knight points or more 'windmill' points (a picture of a windmill on some cards),<br/>     a bonus resource,<br/>     an attack if a player has too many resources, and<br/>     one of six special events - civil war, conflict, master builder, plague, productive year, or progress.     <br/><br/><br/>There are 62 expansion cards in six stacks in the center of the table. Before beginning the game, players choose one stack, go through it, and choose three cards to hold in their hands. Forty-two of the expansion cards require spending resources to be put into play, gaining civic improvements or knights. Every civic improvement serves some useful function or adds victory points or both. Twenty of the cards are actions benefiting one of the players or harming the other. After a player pays to put a card down or uses an action card, he blindly draws a replacement. Unwanted or unusable cards can be traded in future turns. Some of the cards have flags on them, indicating victory points.<br/><br/>Whoever first has twelve victory points wins the game!<br/><br/>The Anniversary edition of this game (Jubil&auml;umsausgabe, tin box edition) can be found under a separate game entry due to some differences in content: Die Siedler von Catan: Das Kartenspiel – 10th Anniversary Special Edition Tin Box.<br/><br/>Belongs to the Catan Series.<br/><br/>"",1996,,,";;;;;;;;;;;;;;;;;;;;;;;;;;;;;;;;;;;;;;;;;;;;;;;;;;;;
"279,Rørleggern,""['Hand Management', 'Move Through Deck', 'Pattern Building', 'Take That', 'Tile Placement']"",""['Abstract Strategy', 'Card Game']"",""The game consists of a set of cards. The cards have white and black pipes in various six-outlet configurations, and players take turns placing them onto the table.  When a player constructs a completely closed-off section of pipe in their color, he takes all the cards from that section.  After all cards have been played, the player with the most scored cards wins.  Additionally, the cards also have two different floors (which appear underneath the pipes) that can be used to expand the game to a four-player affair.<br/><br/>The game was re-released in 2002 with a reduced deck (48 cards instead of 120) as part of the Hip Pocket Games series.<br/><br/>"",1996,,,";;;;;;;;;;;;;;;;;;;;;;;;;;;;;;;;;;;;;;;;;;;;;;;;;;;;
"280,Neue Spiele im alten Rom,[],""['Abstract Strategy', 'Game System']"",""Neue Spiele im Alten Rom (or New Games in Old Rome (NGIOR)) is a compendium of games from Reiner Knizia. In the box are fourteen games themed on ancient Rome. The games are themed to cover, albeit in a highly abstract fashion, the rise of Rome, the Roman Republic and finally, the Empire.<br/><br/>(7 of the games are described below)<br/><br/>The Wheel of History : 2-5 players<br/><br/>This is an early version of what was to become Bunte Runde. 25 cards are laid out in a large circle, representing the tribes to be united under early Rome. Players may advance a pawn one, two or three spaces forwards and collect a card. Cards are scored on face value, but there are some quirks that vary this.<br/><br/>The Seven Hills of Rome : 2 players<br/><br/>This is one of the easier games in the compendium. The theme here is you are battling your opponent for control of the seven hills of Rome. The hills are represented by seven cards, numbered 1 to 7, laid out between the players. Cards are played from a hand against the 'hills' in an attempt to influence them to your side. You sum the hills you control at the end of the game, and the highest total wins.<br/><br/>Mercator : 3-7 players<br/><br/>This game is Medici's ancestor. It is a simplified version of Medici, with the chief differences being you can hold six cards on your ship, and you are competing for highest value totals only. The number of each suit taken is meaningless, except in a variant where you get paid a bonus if you get one of each. The game lasts only one round. Medici is worth purchasing on its own, but this is still worth a look.<br/><br/>Imperium : 3-5 players<br/><br/>The aim is to earn points for control of each of the 9 areas on the board. The game lasts 9 turns, and at the end of each turn, the area matching the turn number is evaluated for control and points are awarded. On your turn, 3 cards are revealed simultaneously. These cards are numbered 1 to 9, with 2 additional banner cards. The numbers correspond to the areas you want to place control markers into. The banner cards indicate you want one or two extra chips placed in the indicated area. After control markers are placed, the current turn's area is evaluated - points being awarded to the winner and perhaps the second and third places as well. After 9 turns, the player with the most points wins. As you progress, the points awarded for each area increases, giving a nice feeling of acceleration.<br/><br/>Senator : 2-3 players<br/><br/>You play a Roman faction trying to position your people (a hand of cards) into the senate. They can only get their via the senate steps. The board is a grid of 5x5 spaces, The 9 spaces in the center are the senate, while 12 of the remaining 16 are the steps spaces that run around the perimeter of the senate. Cards are placed initially on the steps, and then pushed into the senate by placing more cards on the steps.<br/><br/>Circus Maximus : 3-5 players<br/><br/>A simple chariot racing game where players are competing to be the first to get their team of three chariots around the hex map circuit and onto the podium. Each player has a set of cards face up in front of them, numbered 1 to 5. To move a chariot they select up to three cards per chariot which that is the movement allowance for that piece. The movement off each card must be in a straight line, so some rather clumsy cornering ability is built into the game. Cards used by a chariot are turned face down, becoming unavailable for the other chariots still to move. Each chariot must be moved at least once per turn, if possible. Therefore, the trick is to maximize your movement with your 15 points each turn.<br/><br/>Consul : 2-4 players<br/><br/>This is an intriguing memory game, that, like most of the games in this compendium, have a hard time being fitted into a theme! Twenty-five cards are turned face down in a grid. Players start the game each holding three cards in their hand. On their turn, players make a bid to take a turn. The highest bid gets to turn up cards until they choose to finish, or make a mistake. Cards in a set can be of the same value, or same color, or both. The value of the set must equal of exceed the bid made, simply by summing the face values of the cards. If a mistake is made, the cards are turned face down, and the player must discard a card from their hand into the grid. If the bid is made, the cards are taken into the players hand. At the end of the game, the highest total held wins.<br/><br/>--<br/><br/>Translated rulebook to the contrary, this game has never been published by an English publisher.<br/><br/>Note: 3 of these have been printed/repackaged in English by GMT in Rome: Imperium, Circus Maximus, Hannibal vs Rome.<br/><br/>"",1994,,,";;;;;;;;;;;;;;;;;;;;;;;;;;;;;;;;;;;;;;;;;;;;;;;;;;;;
"281,Ostindiska kompaniet,""['Commodity Speculation', 'Pick-up and Deliver']"",""['Economic', 'Nautical']"",""from the translation:<br/>The Swedish East India Company loaded their ships in G&ouml;teborg with Swedish export goods.  These were carried to Cadiz in Spain and there sold in exchange for Spanish silver piastres, the only currency acceptable to the Chinese and South Indian merchants.  From Cadiz the ships sailed east to ports in India and China (invariably Canton in the latter), where they sought to purchase the most profitable goods.  These were carried back to G&ouml;teborg and sold at a healthy profit.  (The Company actually supplied most of the Swedish GNP in those days!)  You will reinvest your profits in new cargo to start the Cadiz/Far East cycle again, but you must also buy shares in the Company.<br/><br/>"",1991,,,";;;;;;;;;;;;;;;;;;;;;;;;;;;;;;;;;;;;;;;;;;;;;;;;;;;;
