"333,Classic Waterworks,""['Take That', 'Tile Placement']"",['Card Game'],""The object of the game is to be the first player to build a complete leak-free pipeline, from your valve card to your spout card. The iron/lead pipe cards can 'leak' (via opponent sabotage), and be repaired with a wrench or a replacement pipe segment; the copper pipe cards never leak. The minimum number of pipe cards you need to place in between the valve and spout varies by the number of players.<br/><br/>In versions that support up to 4 players:<br/>2 players = 12 pipe cards<br/>3 players = 10 pipe cards<br/>4 players = 8 pipe cards<br/><br/>In versions that support up to 5 players:<br/>2 players = 15 pipe cards<br/>3 players = 12 pipe cards<br/>4 players = 10 pipe cards<br/>5 players = 8 pipe cards<br/><br/>"",1972,,,";;;;;;;;;;;;;;;;;;;;;;;;;;;;;;;;;;;;;;;;;;;;;;;;;;;;
"334,Advance to Boardwalk,""['Area Majority / Influence', 'Dice Rolling', 'Hand Management', 'Take That']"",['Economic'],""Don't let the name fool you. The game has nothing to do with Monopoly. The name was obviously chosen in an attempt to capitalize on that mega-selling monster.<br/><br/>There are four tracts of land illustrated on the board, which depicts an ocean-front boardwalk. Each tract of land contains five properties valued from $1 million to $8 million. Each turn, a player rolls two regular dice and one special die. The special die has four sides depicting a color matching one of the land tracts, with the other two sides depicting a 'W' and 'F' respectively. The number rolled on the regular two dice is the amount of money the player can spend on development, while the color depicted on the special die is the tract of land he may build on. Thus, if a player rolled an 8 and a red, he has $8 million to spend on developing buildings in the red tract. He can split this $8 million as he sees fit. For example, he may build a building on the $5 million plot and one on the $3 million plot; or he may opt to build one building on the $8 million plot. Quite a few building options here.<br/><br/>If a 'W' was rolled instead of a color, the player may select which tract he wishes to build on. The 'F' means that a player draws a Fortune card and does not build that turn. Fortune cards allow a player to perform a variety of actions, including constructing extra buildings, moving one of his already placed buildings, removing an opponent's building, etc. A player may play one of these Fortune cards per turn.<br/><br/>When a player constructs a building and obtains the most buildings on a particular plot, he takes the deed to that property and moves his token along the boardwalk an amount equal to the value of the deed. If a player wrested control of the deed from an opponent, the opponent is then moved back that number of spaces. Buildings are placed on the board in a fashion identical to that used in Manhattan...they are stacked on top of existing buildings. If there is a tie for the most buildings, the player who built first on that plot possesses the deed.<br/><br/>Some have described this game as 'Manhattan lite', and they're not far off. One certainly has similar thought processes and must constantly keep an eye out for optimum plays which will wrest control of deeds (control of buildings in Manhattan) from opponents. There's another planning element thrown in, too. Certain spaces along the boardwalk are marked with an 'F'. If a player advances his token to one of these locations, he draws a Fortune card. These cards can be extremely powerful and cause a severe swing in deed controls. Thus, it is not always wise to go for the largest deed acquisition if a lesser gain would allow you to move your token onto an 'F' location. Clever.<br/><br/>The game continues until one player has placed all of his buildings (sounds a bit like Rheinländer, doesn't it?) or until one player has reached the end of the boardwalk. The player with the highest total value of deeds is the victor.<br/><br/>"",1985,,,";;;;;;;;;;;;;;;;;;;;;;;;;;;;;;;;;;;;;;;;;;;;;;;;;;;;
"335,Breakthru,['Point to Point Movement'],""['Abstract Strategy', 'Nautical']"",""Part of the 3M Bookshelf Series.<br/><br/>Breakthru is a modern member of the Hnefatafl family of games, where the players have unequal forces and different objectives. One player, commanding a gold fleet consisting of one large flagship and 12 escorts, has the objective of evading capture while aggressively trying to break through his opponent's blockade in order to escort his flagship to safety. His opponent, commanding a silver fleet attempts to create an impenetrable blockade and then strategically outmaneuver and destroy the gold fleet's escorts with the objective of capturing the flagship and winning the game.<br/><br/>"",1965,,,";;;;;;;;;;;;;;;;;;;;;;;;;;;;;;;;;;;;;;;;;;;;;;;;;;;;
"336,Jumpin,['Grid Movement'],['Abstract Strategy'],""Part of the 3M Bookshelf Series.<br/><br/>Each player has 12 metal pawns (which feel great to hold and move!) and the object is to move these pawns into the back two rows on the opposite side of the board. The first player to accomplish this is victorious.<br/><br/>Movement is very basic. A pawn can only move by leaping over other pawns, ala Chinese Checkers. However, a pawn may leap over any number of pawns that are in a row, either vertically or horizontally. Players alternate making moves until someone wins.<br/><br/>"",1964,,,";;;;;;;;;;;;;;;;;;;;;;;;;;;;;;;;;;;;;;;;;;;;;;;;;;;;
"337,Circus Abracadbra,""['Open Drafting', 'Push Your Luck', 'Set Collection']"",""['Animals', 'Card Game']"",""In Circus Flohcati, players collect acts from the flea circus to score points, with the game containing ten types (colors) of acts, with acts being valued from 0-7 points.<br/><br/>On a turn, you can choose one of the face-up cards on the table and add that to your hand or flip the top card from the deck and add it to the cards on display. If you flip an action card, you must take that action &mdash; often stealing a card from an opponent &mdash; then your turn ends. If you flip a card of the same color as any face-up card, then you instead discard the newly revealed card and your turn ends with you getting nothing. Otherwise, you again face the same options: Collect a face-up card or reveal a new card.<br/><br/>If on your turn you have three cards of the same value in hand, you can play this trio on the table for a guaranteed 10 points. The game ends either when someone reveals that they have all ten acts in hand or when the deck has been exhausted. You score only for the highest-valued act of each color, so either avoid taking duplicate colors or ditch them in trios. If you have all ten acts in hand, score a 10-point &quot;gala show&quot; bonus. Whoever has the highest score wins.<br/><br/>Editions of Circus Flohcati bear a player count of either 2-5 or 3-5, but they don't differ in the rules or nature of the components.<br/><br/>"",1998,,,";;;;;;;;;;;;;;;;;;;;;;;;;;;;;;;;;;;;;;;;;;;;;;;;;;;;
"338,Bargain Hunter,""['Set Collection', 'Trick-taking']"",['Card Game'],""This game illustrates Herr Rosenberg's talent for unique card games.  The deck is one through nine in six suits, with two of each card (two 1s, two 2s, etc.).  After the initial hand of eight is dealt, players select one card value to collect, which is placed face-up in front of each player.  A fairly standard trick-taking game takes place with the remaining cards, with players following suit if they can.  If you cannot, the card you play can be trump, if you desire.  If two cards of the same suit/value appear, the second can be declared as either high or low.  When a player wins a trick, the cards of the same value they are collecting are placed in his 'good' pile, with each worth one point.  All the rest are put in the 'bad' pile, with each worth minus one point.  However at the end of each hand, you can convert one value of cards from your 'bad' pile onto the 'good' pile.  Of course, if you had enough of them, you'll be collecting that value for the next hand...<br/><br/>"",1998,,,";;;;;;;;;;;;;;;;;;;;;;;;;;;;;;;;;;;;;;;;;;;;;;;;;;;;
"339,Quiddler,""['Hand Management', 'Set Collection', 'Spelling']"",""['Card Game', 'Word Game']"",""Quiddler challenges players to create words from an ever-increasing number of letter cards in their hand. The game lasts eight rounds, with three cards being dealt to each player in the first round, four cards in the second, five in the third, and so on. Each card has one or two letters on it as well as a point value.<br/><br/>On a turn, a player draws the top card from the deck or discard pile, then discards a card. When a player is able to use all of the cards in his hand (with one left for discarding) to spell words &mdash; each of which must contain at least two cards &mdash; he may go out by placing the words on the table. Each other player takes one final turn, then plays as many cards as they can in words. Each player now scores, adding the point value for cards used in words, then subtracting points for any cards remaining in hand. In addition, the player with the most words and the player with the longest word each receive 10 bonus points; in case of a tie, no one receives the bonus. Whoever has the highest score after eight rounds wins!<br/><br/>Quiddler also includes rules for a solo variant.<br/><br/>"",1998,,,";;;;;;;;;;;;;;;;;;;;;;;;;;;;;;;;;;;;;;;;;;;;;;;;;;;;
"340,Bláznivá Zoo,""['Hand Management', 'Ladder Climbing', 'Team-Based Game']"",""['Animals', 'Card Game']"",""This game is played in several hands. In each hand the players try to be the first to get rid of all of their cards. Their scores are based on how early in the hand they get rid of all their cards. There are two ways to play: you can play where all hands are played the same, or you can play the game with changing partners.<br/><br/>This is a climbing game, similar to The Great Dalmuti, Tichu, and others.  The difference here is that the ranks are different kinds of colorfully illustrated animals. Each is scared away only by certain other animals.  Players set out one to whatever cards of a particular variety, and someone can play onto that pile only if they have more of that animal or an equal number of some animal that can scare it away.  Players get points by playing all their cards, collecting lions, and collecting a hedgehog.<br/><br/>"",1999,,,";;;;;;;;;;;;;;;;;;;;;;;;;;;;;;;;;;;;;;;;;;;;;;;;;;;;
341,,[],[],,,,,;;;;;;;;;;;;;;;;;;;;;;;;;;;;;;;;;;;;;;;;;;;;;;;;;;;;
"342,Hong Kong,""['Square Grid', 'Stacking and Balancing']"",""['Abstract Strategy', 'City Building']"",Hong Kong is an abstract 2-player strategy game where players take turns building skyscrapers in Hong Kong. Each player is trying to cover the most area while simultaneously trying to take over each other's buildings.  The player covering the most squares on the board wins the game.<br/><br/>,1999,,,";;;;;;;;;;;;;;;;;;;;;;;;;;;;;;;;;;;;;;;;;;;;;;;;;;;;
"343,Twins,['Hand Management'],""['Bluffing', 'Card Game']"",""Twins has a sixty-card deck, with cards coming in six suits numbered 1-10; some cards have white numerals, while others have black numerals.<br/><br/>In a round, each player receives eight cards from the deck, then can buy more from the pool; each player starts with 12 money. Each round lasts four turns, and on each turn players simultaneously reveal a pair of cards from their hand. Cards with the same numeral and same numeral color (&quot;twins&quot;) outrank cards of the same numeral but different numeral colors (&quot;pairs&quot;), which outrank two cards of the same suit (&quot;colors&quot;), which outrank anything else; sums of values act as a tiebreaker.<br/><br/>On the first turn, some number of players with the lowest-ranked cards pay two money to the kitty in the middle of the table; on the second turn, some number of players with the highest ranks each take three money; on the third turn, some number of players with the lowest-ranked cards pay one money to the kitty and drop from the round; and on the fourth turn, the player with the highest-ranked cards takes the kitty. The number of players who pay or win money varies depending on the number of players. Rounds continue until someone runs out of money, then the player with the most money wins.<br/><br/>"",1996,,,";;;;;;;;;;;;;;;;;;;;;;;;;;;;;;;;;;;;;;;;;;;;;;;;;;;;
"344,Classic Art,""['Betting and Bluffing', 'Hand Management']"",['Card Game'],""In Classic Art, first released as Members Only, players attempt to predict how many works of art will be present in five exhibitions. The riskier your predictions in a season, the more you score &mdash; but only if you're correct, of course!<br/><br/>The game consists of 65 cards, with 13 cards in each of five categories; eleven of the cards are &quot;positive&quot; and two are &quot;negative&quot;. At the start of each season, players get a hand of cards (7-11 depending on the player count) and two cards are placed face up from the deck in their respective exhibitions.<br/><br/>In the first round of the season, players may predict how many works of art will be in an exhibition at the end of the current season by placing 1-2 tokens (along with their high risk token) on a prediction space. Each exhibition allows you to bet on whether the art will be rare (bet spaces 1-4) or plentiful (bet spaces 5-8). In each subsequent round, a player must place two cards from their hand in the appropriate exhibitions, then they may place a prediction. They may place only one &quot;double token&quot; prediction in a season, and predicting is optional. When all players have only three cards in hand, they each discard one face down, then place the other two cards in exhibitions. Whenever a negative card and positive card appear in an exhibition, remove them.<br/><br/>At the end of a season, players score for correct predictions. If art in an exhibition is &quot;rare&quot;, i.e., four or fewer works, then all plentiful bets fail, and vice versa. What's more, a rare bet succeeds only if the number of works is equal to or fewer than the bet, e.g., if you bet 3, then you succeed only if three or fewer works of art are present. A plentiful bid succeeds only if the number of works is equal to or more than the bet. The riskier the bet, the higher the payout per token in that successful bet, with players recording points separately for each exhibition.<br/><br/>At the end of a season, tokens on failed bets (other than the high risk ones) are removed from play, while tokens on successful bids are returned to players. If a player has zero or one tokens at the end of a season, all of their tokens are returned to them.<br/><br/>A player can score at most 10 points in an exhibition. Continue playing seasons until at the end of a season, each exhibition has at least one player who has scored 5 points in it. The game ends at the point, and players tally their scores &mdash; but tokens in the 0-4 range in an exhibition are worthless. Whoever scores the most points wins!<br/><br/>In Members Only players bet on odd things like how many royal scandals will happen in a month, and in Glenn's Gallery, another version of this design, players bet on the number of customers who will show up to look at types of art, but otherwise gameplay is nearly identical to Classic Art. The only difference is that each player has a dedicated &quot;double bid&quot; token instead of being allowed to bid two tokens once per season.<br/><br/>Classic Art includes a two-player variant that can be used in prior releases. After dealing eleven cards to each player, set up a ten-card &quot;house&quot; deck. On each player's turn, they play the top card of the house in addition to two cards from their hand. In the last round, play the final two cards from the house along with the chosen two cards from both players.<br/><br/>"",1996,,,";;;;;;;;;;;;;;;;;;;;;;;;;;;;;;;;;;;;;;;;;;;;;;;;;;;;
"345,Prairie Railroads,""['Network and Route Building', 'Stock Holding']"",""['Economic', 'Trains']"",""from session report:<br/><br/>Action chits drive the game - on your turn you can play an action chit from your pool, or draw one from the cup and playing the drawn action.<br/><br/>Actions come in three flavours:<br/><br/>Offer Stock: a share stock is auctioned off. There are six companies, five shares per company. In order to make money you need shares in companies, then get those companies building crayon track across the laminated board. A very nice mechanic makes the money paid for the stock go into that company's coffers. It is these funds that the company must use to build track, so while you may get a bargin share for $1, that's not much use as it costs $5 to build a track segment. Very clever, and it certainly adds a twist to the old bidding mechanic.<br/><br/>Construct Track: a company's coffers are plundered for funds to build track. More track segments built, the more the payout per share when the next action is played.<br/><br/>Pay Dividend: each company pays the dividend bonuses to all shareholders. The total dividend is based on the value of towns connected by track, with bonus $1 for towns that experience &quot;growth&quot;. This total is divided by 5 (shares per company) then each shareholder receives this amount per share. A bit mathematical, but by keeping records as you go, it is pretty painless. As there are only 8 Pay Dividend chits in the game (well, 3 player game), it is a reasonably rare occurrence compared to the other two actions. <br/>The game ends when the 8th Pay Dividend is played, with a slightly different tweak on the final payouts.<br/><br/>"",1999,,,";;;;;;;;;;;;;;;;;;;;;;;;;;;;;;;;;;;;;;;;;;;;;;;;;;;;
346,,[],[],,,,,;;;;;;;;;;;;;;;;;;;;;;;;;;;;;;;;;;;;;;;;;;;;;;;;;;;;
"347,Fishy,['Hand Management'],""['Animals', 'Bluffing']"",""Fishy is the second of the set of games published by Alan Moon himself. It is not one game but three games that can be played with the same set of playing pieces.<br/><br/>1. Rotten Fish: The first game is about fish in a barrel. Round by round the fish moves toward the rotten bottom of the barrel. The players play one card from their hand. Depending on how many players have chosen a card, fish can be taken from the barrel. <br/>The game ends when a player has five fish on the bottom of the barrel.<br/><br/>2. Fresh Fish: The card playing mechanism in this variant is similar to the one in Rotten Fish. In this game players try to buy fish from the different &quot;displays&quot; in the barrel.<br/><br/>3. Fish in the Barrel: By playing their cards players try to sell their fish to the market (the barrel). Depending on the cards the other players played a player can place 1 - 4 fish in the barrel.<br/><br/>"",1991,,,";;;;;;;;;;;;;;;;;;;;;;;;;;;;;;;;;;;;;;;;;;;;;;;;;;;;
"348,Die Händler,""['Commodity Speculation', 'Pick-up and Deliver', 'Track Movement', 'Variable Player Powers']"",""['Economic', 'Medieval', 'Negotiation', 'Transportation']"",""A Medieval game of trade and commerce, Die H&auml;ndler is set in Europe, where trade wagons carry wares between six cities on the board. Essentially, players buy goods, load them onto wagons and send them for maximum profit in other cities.<br/><br/>The whole game looks very inviting. The medieval cities depicted on the board, together with the player crests, cardboard coins, money pouches, sticker decorated wagons and wooden commodity pieces, immediately creates the right atmosphere for the players.<br/><br/>There are six cities - Paris, Cologne, Brugge, Gent, Vienna and Genoa - which are interconnected by roads. Three wagons carry goods from one city to another. No-one owns the wagons or controls any of them single-handedly, and in principle a player can put commodities on any transport. There are six different commodities - salt, iron, wine, silk, cloth and food - all of limited supply.<br/><br/>The goal of the game is to make money by delivering goods to the towns, and use the money to buy increases in status.  The game ends after a certain number of deliveries have been made and the winner is the player with the highest level of status.<br/><br/>"",1999,,,";;;;;;;;;;;;;;;;;;;;;;;;;;;;;;;;;;;;;;;;;;;;;;;;;;;;
"349,Halunken & Spelunken,""['Set Collection', 'Simultaneous Action Selection']"",['Card Game'],""Light game in which players try to collect a suitable crew for their vessel. A deck of scoundrels of different values is shuffled and dealt face-down onto a circle of inns. The top scoundrels are turned up and players use movement cards to send their captain around the pubs, collecting the face-up scoundrel of choice. Players select their movement card in secret, and when selections are tied, neither moves. Highest number of scoundrels of the same color are worth double for each player. There is a harder variant using Black Jack. Players bid to control Black Jack and he helps you steal scoundrels.<br/><br/>"",1997,,,";;;;;;;;;;;;;;;;;;;;;;;;;;;;;;;;;;;;;;;;;;;;;;;;;;;;
"350,Hattrick,['Trick-taking'],['Card Game'],""extrapolated from the Game Cabinet:<br/><br/>A card game with an unusual rule where two tricks can be opened at the same time<br/><br/>The player to the left of the dealer starts by playing any one card. Now each player follows in clockwise order playing a card, until everybody played one. The second player has the option to play either a card with the same color, or to open a second trick by playing a card of an different color next to the already played card. When someone plays a second color, he starts a second trick on the table. If the second player started a second trick, the third player just has the options to follow either one of the colors or discard a card of the third color (pass). He may not place a card of the third color on one of the existing tricks or start a third trick. If the second player followed the color of the first card, the third one has the option to start a 2nd trick (and so on).<br/><br/>The players who played the card with the highest number in the respective trick win the respective cards. They place them visible to everyone in front of themselves on the table, stacked by colors, so everyone can see which color they are collecting. The player with the highest card in both tricks starts to play a card for the next round<br/><br/>After all rounds are completed highest score wins.<br/><br/>3rd and 4th version of Sticheln by the same game designer allow to play Hattrick, too. It is explained in the rules book as a variant.<br/><br/>1997 Mensa Select<br/><br/>"",1995,,,";;;;;;;;;;;;;;;;;;;;;;;;;;;;;;;;;;;;;;;;;;;;;;;;;;;;
351,,[],[],,,,,;;;;;;;;;;;;;;;;;;;;;;;;;;;;;;;;;;;;;;;;;;;;;;;;;;;;
"352,Trumpet,['Trick-taking'],['Card Game'],""In this light, short trick-taking game, there are six suits with cards numbered one through eleven, plus 3 wild cards. If you take a trick, you advance your scoring token, however each scoring space can only be occupied by one person, jumping the piece<samp> immediately ahead of you. In addition, there are certain spaces which allow that player to set one of the suits as trump. Eventually all the suits are established as some form of trump, however each of them is ranked top to bottom. Once one of the players enters the home stretch of the scoring track, players can chose to move the leaders back a space instead of moving themselves up, but the winner is the player who crosses the finish line first.<br/><br/>Won Games Magazine Game of the Year award in 1991.<br/><br/>"",1990,,,";;;;;;;;;;;;;;;;;;;;;;;;;;;;;;;;;;;;;;;;;;;;;;;;;;;;
"353,Inkognito: The Card Game,['Hand Management'],""['Card Game', 'Deduction', 'Murder/Mystery']"",""It is Carnival in Venice, and you are seeking your partner, one of three other world famous secret agents.  Your mission is to make contact with that agent and trade information that will allow the two of you to break into a safe containing the last known whereabouts of a mysterious figure known only as &quot;the Grand Old Man.&quot;  But beware, for another team of agents has been sent to Venice as well, to steal the information before you, and one mistake could cost you your life...<br/><br/>In INKOGNITO: THE CARD GAME, each player is assigned the role of one of four secret agents: Lord Fiddlebottom, Colonel Bubble, Agent X or Madame Zsa Zsa, and must deduce who the other players are by arranging meetings with them to share tidbits of information.  The players may also meet up with &quot;the Ambassador&quot; to gain valuable knowledge about the other spies.  The first player to deduce the identities of the other agents and meet up with their partner wins the game.<br/><br/>INKOGNITO: THE CARD GAME is a deductive card game of secrets, lies, and investigation for 2-5 players, playable in 2-30 minutes.<br/><br/>Re-implements:<br/><br/>    Inkognito<br/><br/><br/>"",1997,,,";;;;;;;;;;;;;;;;;;;;;;;;;;;;;;;;;;;;;;;;;;;;;;;;;;;;
