Game ID,Game Name,Game Mechanics,Game Categories,Game Description,Game Year,Game Ratings,Game Mechanics Statistics,Game Historical Data (Number of plays);;;;;;;;;;;;;;;;;;;;;;;;;;;;;;;;;;;;;;;;;;;;;;;;;;;;
"200,Entdecker,""['Area Majority / Influence', 'Modular Board', 'Tile Placement']"",['Exploration'],""[Careful: there are two similar games with Entdecker in the title. Don't confuse Entdecker with Die Neuen Entdecker (also known as Entdecker: Exploring New Horizons), a different game. In short - if your Entdecker's board has a scout trail leading to native huts, it's not this Entdecker.]<br/><br/>Entdecker starts with a blank game board that represents an unexplored sea. Tiles are drawn and placed on squares on the board. As the tiles are placed islands develop on the board and players pay to place settlements, bases, or scouts on these islands in an effort to become the most powerful discoverer of all. Completed islands yield victory points to all who have invested in exploration on an island, but of course the most points go to the player who has established the strongest presence.<br/><br/>Re-implemented by:<br/><br/><br/>     Die Neuen Entdecker or Entdecker: Exploring New Horizons<br/><br/><br/><br/>     In 2004, a smaller version of the Entdecker game was released, based on the online version available on the <a target='_blank' href=""""http://www.playcatan.de"""" rel=""""nofollow noreferrer noopener"""">www.playcatan.de</a> site.<br/>         Oceania.<br/>    <br/><br/><br/><br/>     In 2007, the game system was revamped in a new &quot;Entdecker&quot;-series of 3 titles (so far):<br/>         Im Reich der Jadegottin (published 2007)<br/>         Im Reich der Wüstensohne (published 2008)<br/>         Im Reich der D&auml;monen (not yet published)<br/>    <br/><br/><br/>"",1996,,,";;;;;;;;;;;;;;;;;;;;;;;;;;;;;;;;;;;;;;;;;;;;;;;;;;;;
"201,Le Roi Des Roses,""['Area Majority / Influence', 'Grid Movement', 'Hand Management', 'Move Through Deck', 'Pattern Building', 'Square Grid', 'Static Capture', 'Sudden Death Ending', 'Tile Placement']"",""['Abstract Strategy', 'Medieval']"",""Originally published as Texas by db-Spiele.<br/><br/>The battle between farmers and ranchers is fairly abstract. A single pawn travels on a square grid. Each player has a hand of cards face up. These each have a direction and a distance. The player can either draw a card and add it to his hand, or play a card. If he plays a card, then the pawn moves the appropriate distance to an empty square, and the player places one of his markers. Each player also has judge symbols that can each be used only once. The judge lets you move onto a previously placed opposition marker and reverse it. Players score points for each contiguous region equal to the square of the number of markers. If a player is not careful, such a move may be forced, as there is a maximum number of cards that a player may hold.<br/><br/>Contains rules for playing with 4 (in two partnerships of two players).<br/><br/>Later republished 1999 as Rosenk&ouml;nig by Kosmos, as part of the two-player game series. The republication also included a re-theming of the game. The setting changed from Texas to England, and the factions changed from farmers and ranchers to the factions of the Plantagenet family from the Wars of the Roses (1455-1485) - the Lancaster (red rose) and the York (white rose) factions in a similarly abstracted fashion.<br/><br/>Rosenk&ouml;nig is part of the Kosmos two-player series.<br/><br/>"",1992,,,";;;;;;;;;;;;;;;;;;;;;;;;;;;;;;;;;;;;;;;;;;;;;;;;;;;;
"202,Targui,""['Modular Board', 'Player Elimination', 'Tile Placement', 'Variable Set-up']"",""['Arabian', 'Wargame']"",""Conquer and occupy the valuable desert grounds. And also keep your home village! By tactically moving groups of camels through the different desert grounds and by using its specialties you can rule the desert. -- from the rulebook<br/><br/>Targui has a board made of large square tiles representing the different types of desert ground. These provide varying economic and strategic value, from 0-5, and with a salt mine in the center, random distribution (with a little tinkering) makes a varied map each game. Players have a village tile which they place on the outer edge, and start with some camels and money. Your turn simply consists of moving and buying camels, expanding your control of the land.<br/><br/>Targui has very simple mechanisms, and is in effect a simple rolling war game with obvious tactics. But the random turn order creates a wonderful world of rapidly shifting alliances, with players making and breaking promises within moments. The winner is not the one with most money or camels, but with the most economic value under their control.<br/><br/>The game plays nicely with 3 or 4 players. However, Targui is a long game. Eight rounds takes about three hours, so using the whole deck of 20 fortune cards makes for an over-long game. If you enjoy Risk or light wargaming, then you'll get a lot from Targui.<br/><br/>"",1988,,,";;;;;;;;;;;;;;;;;;;;;;;;;;;;;;;;;;;;;;;;;;;;;;;;;;;;
"203,Skworms,""['Roll / Spin and Move', 'Take That']"",""['Action / Dexterity', """"Children's Game"""", 'Horror']"",""&quot;The Worms Crawl In, The Worms Crawl Up Game&quot; <br/>The object of the game is to be the first to get all your worms up the skeleton's bones so they disappear into his skull.<br/><br/>The players divide the worms between themselves, the youngest starts and the oldest gets the brain (a bad thing). On your turn, you spin the spinner to find out what you're allowed to do; this can be: <br/>- hang one of your worms on the skull, <br/>- pull a worm out of the skull and give it to another player, <br/>- give a worm to the player with the brain, <br/>- give/take the brain and spin again, <br/>- feed 1 worm to the skeleton, or <br/>- feed 2 worms to the skeleton.<br/><br/>When feeding worms to the skeleton, you turn the crank and hope your worm(s) will crawl up into the skull--but there's a chance it'll fall right back out into your lap, possibly accompanied by other worms that got stuck during a previous player's turn.<br/><br/>"",1997,,,";;;;;;;;;;;;;;;;;;;;;;;;;;;;;;;;;;;;;;;;;;;;;;;;;;;;
"204,Stephenson's Rocket,""['Area Majority / Influence', 'Auction: Once Around', 'Chaining', 'End Game Bonuses', 'Grid Movement', 'Hexagon Grid', 'Investment', 'Network and Route Building', 'Set Collection', 'Stock Holding', 'Tile Placement']"",""['Trains', 'Transportation']"",""Reiner Knizia expands his fleet of tile laying games with this game about colliding railroads in early 1800's England.  There are seven different rail companies that players can expand.  Each time you extend a rail, the other stockholders can veto your action, but it might cost them their shares.  When two companies' rail touch, the railways merge to become one.  The game is over when only one company remains or there are no rail tiles remaining, and the winner is the player who earned the most money over the course of the game.<br/><br/>"",1999,,,";;;;;;;;;;;;;;;;;;;;;;;;;;;;;;;;;;;;;;;;;;;;;;;;;;;;
205,,[],[],,,,,;;;;;;;;;;;;;;;;;;;;;;;;;;;;;;;;;;;;;;;;;;;;;;;;;;;;
"206,Jalape-NO!,['Trick-taking'],['Card Game'],""Jalape-NO!, first released as Pepper, is a trick-taking game in which you want to dodge the spiciness to end up with the lowest score possible.<br/><br/>The deck consists of 108 cards (102 number cards and 6 pepper cards), with cards being numbered 1-18 in six colors and with the 1s being peppers. Based on the player count, you use 4-6 colors of cards ranging from 1-9 to 1-18.<br/><br/>At the start of each round, you receive 12 cards in hand, and you must place any peppers on the table in front of you. The lead player in a trick plays any card from their hand or one of their peppers. Each other player must follow suit, if possible, except that you are not forced to play the matching pepper card, should you have it. (However, if you do have it, you cannot play a pepper of another color to this trick.) Whoever plays the highest card in the suit led wins the trick and leads the next trick. If you win a pepper in a trick, place it on the table in front of you; you can play this pepper on a future trick, whether to lead off the trick or to play it on a trick that's already in progress.<br/><br/>As soon as a player has no cards in hand, the round ends. All players add any cards in hand to the cards in front of them, whether peppers or cards claimed in tricks. Each pepper you have is worth 2 points, and each card in the same suit as a pepper you have is worth 1 point. After five rounds, the player with the lowest score wins.<br/><br/>"",1998,,,";;;;;;;;;;;;;;;;;;;;;;;;;;;;;;;;;;;;;;;;;;;;;;;;;;;;
"207,Twitch,[],""['Action / Dexterity', 'Card Game']"",""Twitch is an insanely frantic game of reacting to new information.  When someone plays a card, you must quickly determine if it points to you (e.g., if the player to your right plays a card that says &quot;left&quot;), and if it does, throw the top card of your deck onto the pile.  If you're not quick enough, another player will call you out, and you'll have to take all the cards in the pile into your deck.  The first person to run her deck out wins.<br/><br/>"",1998,,,";;;;;;;;;;;;;;;;;;;;;;;;;;;;;;;;;;;;;;;;;;;;;;;;;;;;
"208,Ex & Hopp,[],['Card Game'],""A quick and simple card game for 2-6 milk-drinking players. Each player places a color card down as their marker and the matching sets of cards numbered 1-12 in those colors make up the deck. The deck is shuffled and players get 4 cards, the remainder goes down as a draw deck. There is a set of small tiles in red and black for negative or positive points (red are 4,4,5,5,6,6, black are 2,3,3,4,4,4,5,5,5,6,6,6). These are shuffled face down and 4 turned up to start 4 rows.<br/><br/>On your turn, you can place a card against a row or try to swap a card with another player. If you want to swap, you simply offer a color for another color, mentioning no numbers. Swap with the player of your choice, but if nobody wants to swap, you've wasted your turn.<br/><br/>When you play a card to a row, you draw back so you have 4 cards. When the row is full, determined by the number on the tile, the player with the highest total in the cards has to take the tile, be it positive or negative. Usually your choices are obvious, but sometimes it is worth assisting another player to take a row, rather than waste a good card for you on a low or negative tile. If a row is tied between players, the cards are discarded and the tile stays for more cards.<br/><br/>The discard deck is shuffled over, taken tiles refreshed by new ones. The game ends when the tiles are all taken, deduct the negative from the positive to get your score.<br/><br/>This game was re-themed and expanded on with Relikt.<br/><br/>"",1996,,,";;;;;;;;;;;;;;;;;;;;;;;;;;;;;;;;;;;;;;;;;;;;;;;;;;;;
209,,[],[],,,,,;;;;;;;;;;;;;;;;;;;;;;;;;;;;;;;;;;;;;;;;;;;;;;;;;;;;
"210,Don Pepe,['Take That'],""['Card Game', 'Economic', 'Mafia']"",""In this twisted little game, players take control of a gang of mobsters that are dedicated to extorting money out of businesses and rubbing out the competing mobs in the process.  All of the gang members are placed around an oblong table, with some of the places indicating certain benefits.  If a place has a picture of a business, then the player makes money until the mobster is killed or moved.  If the place has a gun, then he can use it to shoot a mobster across the table.  If a place has a knife, then he can use it to stab someone seated next to him.  Plus, some of the mobsters have the ability to kill others all the time by carrying their own knives and guns.  The game ends when all the available money is taken, and the largest pile of cash takes the game.<br/><br/>"",1999,,,";;;;;;;;;;;;;;;;;;;;;;;;;;;;;;;;;;;;;;;;;;;;;;;;;;;;
"211,Ces Années-là...,[],""['Party Game', 'Trivia']"",""In Times to Remember, the players are trying to remember particular times. Is that clear enough? No? Okay, here are more details.<br/><br/>Players aren't trying to remember times from their own lives, but rather times from the shared experiences of humanity as a whole. Each player or team starts the game with a set of brackets or tokens (depending on the version of the game), and the first player to rid herself of brackets wins.<br/><br/>On a turn, all players are confronted with a trivia question, say, &quot;When did the first Star Wars arrive in theaters?&quot; Each player then uses one bracket to mark a particular year or series of years on her individual year chart. Once everyone has placed their answers, the questioner reveals the answer and everyone sees whether that year appears in the range they guessed. If so, they remove that bracket from the game; if not, they keep the bracket. No matter how much you might want to hedge your guesses, eventually you'll need to guess a year dead on, so plumb the depths of your memory and take your best shot!<br/><br/>"",1992,,,";;;;;;;;;;;;;;;;;;;;;;;;;;;;;;;;;;;;;;;;;;;;;;;;;;;;
212,,[],[],,,,,;;;;;;;;;;;;;;;;;;;;;;;;;;;;;;;;;;;;;;;;;;;;;;;;;;;;
213,,[],[],,,,,;;;;;;;;;;;;;;;;;;;;;;;;;;;;;;;;;;;;;;;;;;;;;;;;;;;;
"214,Café Internacional,""['Hand Management', 'Pattern Building', 'Tile Placement']"",['Abstract Strategy'],""This game revolves around the placement of multi-national customers in a restaurant. The board shows many different tables, each with four chairs around them. The tables are grouped by nation, so the Chinese like to sit with other Chinese. However, some of the chairs are on the border between two nations, so a person from either place could occupy the seat. To further complicate this odd tile game, each of the people is either male or female, and tables must be gender-balanced.  As the game progresses some tiles become unplayable...<br/><br/>"",1989,,,";;;;;;;;;;;;;;;;;;;;;;;;;;;;;;;;;;;;;;;;;;;;;;;;;;;;
"215,Tai Pan,""['Hand Management', 'Ladder Climbing', 'Predictive Bid', 'Team-Based Game']"",['Card Game'],""Tichu took much of its rules and mechanics from Zheng Fen. It is a partnership climbing card game, and the object of play is to rid yourself of your hand, preferably while scoring points in the process.<br/><br/>The deck is a standard 52-card pack with four special cards added: dog, phoenix, dragon and Mah Jong (1). When it's your turn, you may either beat the current top card combination &mdash; single card, pair of cards, sequence of pairs, full house, etc. &mdash; or pass. If play passes all the way back to the player who laid the top cards, they win the trick, clears the cards, and can lead the next one. The card led determines the only combination of cards that can be played on that trick, so if a single card is led, then only single cards are played; if a straight of seven cards is led, then only straights of seven cards can be played, etc.<br/><br/>The last player out in a round gives all the cards they won to the player who exited first, and the last player's unplayed cards are handed to the opposite team. Fives, tens and Kings are worth 5, 10 and 10 points, with each hand worth one hundred points without bonuses &mdash; but the bonuses are what drive the game. At the start of a round, each player can call &quot;Tichu&quot; prior to playing any card. This indicates that the player thinks they can empty their hand first this round; if they do so, their team scores 100 points, and if not, their team instead loses 100 points. Cards are dealt at the start of a round in a group of eight and a group of six; a player can call &quot;Grand Tichu&quot; after looking at only their first eight cards for a &plusmn;200 point bonus. If both players on a team exit a round prior to either player on the opposite team, then no points are scored for cards and the winning team earns 200 points (with Tichu/Grand Tichu bonuses and penalties being applied as normal).<br/><br/>The first team to 1,000 points wins.<br/><br/>"",1991,,,";;;;;;;;;;;;;;;;;;;;;;;;;;;;;;;;;;;;;;;;;;;;;;;;;;;;
"216,Atlanteon,""['Area Majority / Influence', 'Tile Placement', 'Variable Player Powers']"",""['Abstract Strategy', 'Napoleonic']"",""The original edition, titled Revolution, is set in French Revolution-era Paris. Royalists and Jacobins fight for superiority in the 25 city districts, which are represented by the game board. The two players alternately place one of their counters in order to control that space. When a player puts one of his number counters on the board, he projects influence onto the neighboring spaces in that row and column, and onto the space the counter itself is on. The amount of the influence corresponds to the number on the counter. Whoever controls all three of the buildings or controls eleven city districts has won the game.<br/><br/>The game was later reprinted as Atlanteon, in which mighty undersea warriors fight to control the capital of the Sunken Kingdoms. One player controls the vicious Marauders, who are trying to capture the city, while the other player controls the heroic Guardians, who are trying to defend their home.<br/><br/>"",1992,,,";;;;;;;;;;;;;;;;;;;;;;;;;;;;;;;;;;;;;;;;;;;;;;;;;;;;
"217,À la carte,""['Action Points', 'Dice Rolling', 'Set Collection']"",['Action / Dexterity'],""In one of his sillier games, Karl-Heinz Schmiel casts the players as semi-psychotic cooks attempting to hone their culinary skills. Each player receives a miniature pan and a hotplate. Then each turn you can either attempt to turn up the heat, season your dish, or attempt to steal another cook's recipe in the making. Heating your hotplate is a random affair with a die, and could raise the heat on everyone's plate. Spicing the dish is heart of the game and done by up-ending small bottles filled with little colored wood pellets. When the pellets tumble out of the bottle (sometimes, if they do), the number of pellets can't exceed two, because over-spicing the dish ruins it and you have to throw it in the trash!<br/><br/>The 2009 version includes some changed rules, a new victory condition, additional recipes and some new mechanics in comparison to the 1989 version.<br/><br/>"",1989,,,";;;;;;;;;;;;;;;;;;;;;;;;;;;;;;;;;;;;;;;;;;;;;;;;;;;;
"218,Auction,""['Auction/Bidding', 'Set Collection']"",['Negotiation'],""Players represent collectors attempting to gather sets of valuable properties and artifacts ... coins, antiques, miniatures, etc. These sets are worth handsome sums at game's end. Individual pieces of a set are worthless at game's end, but are able to be sold during the course of the game in order to provide a cash-flow.<br/><br/>These 'properties' are represented on cards. There are 12 different types of properties, varying from 3 - 6 pieces per set. Naturally, the sets containing six pieces are much more valuable than the sets containing only three pieces as it is much more difficult to complete these larger sets.<br/><br/>Each player is dealt six cards and given a starting 'fund' of $2,000. The top 'property' card is revealed and a bidding ensues. The winner pays the bank and takes the card into his hand. The player then has the option of selling 1 - 3 properties to the bank. The idea here is to rid yourself of properties that you do not wish to collect and provide a source of income.<br/><br/>There is danger, however. The sales price is determined randomly via the roll of two dice. The price can vary from 25% - 100% of the listed worth of the item. Further, if a '0' is rolled on one of the dice, then the item is NOT sold outright, but rather an auction takes place amongst the players. This can result in a substantially reduced price to the seller, or a higher price, depending upon the demand for the item. Further, it is quite possible that no one desires the item, so the seller must take the item back into his hand. There is also the possibility that the player will earn a $200 bonus if the proper digit is rolled on one of the dice.<br/><br/>When a property is sold, it is placed on the appropriate section of the 'board' - 25%, 50%, 75%, or 100% (there really isn't a board, just a card holder that indicates these sections). After a player sells properties, he may surrender one of the special 'buyer' cards and purchase from 1 - 3 cards from one of these markets. The player must pay the indicated price (based on the particular percentage market where the property is located) and take the property into his hand.<br/><br/>Again, there is a decision to be made here. Buyer cards are very valuable, as they can be used in a number of fashions:<br/><br/>1) Purchase properties, as described above;<br/><br/>2) Used as a 'wild' card to complete a set; or<br/><br/>3) Valued as $500.00 at the end of the game.<br/><br/>So, a player has to weigh the advantages of each of these options and play accordingly.<br/><br/>Buyer cards are purchases at auction in conjunction with a property card. When a Buyer card is revealed, another card is then revealed, and both cards are then auctioned together. The auction is a 'sealed' auction, however, so the stakes are often high as these cards carry tremendous advantages.<br/><br/>The game continues in this fashion until the property deck expires or a player calls an end to the game. One can only do this, however, if he has a total value (property sets plus cash) in excess of $5,000. Even then, a player should only do this when he feels he has more assets than any of his opponents.<br/><br/>As High Bid, this game was published for the 3M Bookshelf Series and 3M Gamette Series.<br/><br/>"",1963,,,";;;;;;;;;;;;;;;;;;;;;;;;;;;;;;;;;;;;;;;;;;;;;;;;;;;;
"219,Volle Hutte,""['Hand Management', 'Tile Placement']"",['Economic'],""Players take on the role of club-owners vying for customers' Deutsch Marks in this unique board game, called Full House in German.<br/><br/>Each player is given a small board representing their cafe or pub. In your turn, you can either place a tile in your pub, representing different types of seating (bar, patio, formal) &amp; activities (dancing, shooting pool, playing fooseball), or you can select a customer card, to draw in customers to those specific tiles, if you have the seating available. A third choice is to take a Billing card, which gives you a tip in cash money, and makes all customers in all the players bars pay their bills too. Yellow customers are worth 10 DM, red 20 DM and blue customers pay 30 DM.<br/><br/>When there are at least ten customers floating around, players can also spend a Action card which moves customers around. The cards either move off a specific tile type to a type you choose, or from a tile type you choose to a specific tile. So you might move customers specifically from the terrace seating to any other type of your choice (such as the disco floor), or from a tile of your choice (such as the bar) to specifically a Pool Table. The cards allow from 1-4 customers to move, depending on the tiles.<br/><br/>This is the clever part. As the customers move, they normally pay their bill, unless the Action card shows a No Pay symbol, making them bill-dodgers. When customers move, they first look for a suitable spot within the same pub! Only if they can't find one (either it lacks that type of tile, or there isn't enough room to accommodate them), do they then start wandering clockwise to the next pub, and keep going until they find a suitable spot. If they can't, they leave the game.<br/><br/>So if you have an Action card that pays a bill, and you have the right empty spaces in your bar (because you've carefully put in a variety of attractions), you move your customers around inside your bar and collect the money (&quot;Hey, we're paying our bar tab now, we're gonna shoot some Pool&quot;). If you have a suitable Action card with a No Pay symbol, you move customers from another player's bar into yours (&quot;This place stinks guys, let's skip out and find a Fooseball!&quot;). It is this clever management of customers that will net you big profits.<br/><br/>And if your bar is pretty full, especially with blue and red customers, you call a billing as your first action. The other players also collect, but you should have a margin on them, plus the tip (from 30-70 DM).<br/><br/>There are always three Customer cards and three Action cards face up, and two fresh tiles, so you should be able to make good choices and plan ahead a little. The game ends when the Action cards or the Billing cards are exhausted.<br/><br/>The winner is the player with the most money, having milked the punters as much as possible.<br/><br/>"",1997,,,";;;;;;;;;;;;;;;;;;;;;;;;;;;;;;;;;;;;;;;;;;;;;;;;;;;;
"220,Alta società,""['Auction: Turn Order Until Pass', 'Auction/Bidding', 'Constrained Bidding', 'Hand Management', 'Highest-Lowest Scoring']"",['Card Game'],""In Reiner Knizia's High Society, players bid against each other to acquire the various trappings of wealth (positive-number and multiplier cards) while avoiding its pitfalls (negative number and divisor cards).  While bidding, though, keep an eye on your remaining cash - at the end of the game, even though all those positive-number cards might add up to a win, the player with the least money isn't even considered for victory.<br/><br/>In 2003 re-published by Überplay.<br/><br/>In 2003 published with a new theme by Amigo as Einfach Tierisch.<br/><br/>In 2006, published by University Games as Animalement V&ocirc;tre (French version) and Beestenveiling (Dutch version).<br/><br/>In 2008, re-published by Eagle-Gryphon Games<br/><br/>In 2018, re-published by Osprey Games<br/><br/>"",1995,,,";;;;;;;;;;;;;;;;;;;;;;;;;;;;;;;;;;;;;;;;;;;;;;;;;;;;
