"429,Magalon,[],""['Fantasy', 'Racing']"",""Rivalry between wizards. The players become the wizards who travel through the mysterious forest of Magalon in search of the magic items which will allow them admission to the prestigious &quot;Council of 11&quot;. They have to collect 3 magical items - the Amulet of Power, the Stone of Wisdom and the Ring of Immortality. Whoever possesses these 3 objects will be admitted to the Council.<br/><br/>The aim of each player is to be the first to return to the entrance of the forest with their wizard (the arrival and departure squares) after having collected the necessary 3 items.<br/><br/>"",1998,,,";;;;;;;;;;;;;;;;;;;;;;;;;;;;;;;;;;;;;;;;;;;;;;;;;;;;
"430,Asterix: Das Kartenspiel,['Simultaneous Action Selection'],""['Bluffing', 'Card Game', 'Comic Book / Strip']"",""The year is 50 B.C. Gaul is entirely occupied by the Romans. Well, not entirely... A simple card game themed on the famous comic graphic novels, with indomitable Gauls bashing unfortunate Romans. Players have a set of cards (Asterix, Obelix, Getafix, Cacofonix &amp; Vitalstatistix) numbered 1 to 10, each card having a different combination of 1-4 magic potions to act as a tie-break. A deck of 55 Roman soldiers, ranging from the cook to Crismus Bonus &amp; Julius himself, are competed for in turn. A scoring card is shown, players select their Gaul cards and show them together, highest wins the Roman and discards their winning card. The other players return their cards to their hands to fight again. There are also Pirate cards which reduce your winnings and Dogmatix cards which allow the players to draw from the deck and either keep the card themselves or pass it onto another player. The rank of the Roman increases your score, but combinations of the same rank are worth much more.<br/><br/>Re-implemented by:<br/><br/>    The Gnumies <br/><br/><br/>"",1990,,,";;;;;;;;;;;;;;;;;;;;;;;;;;;;;;;;;;;;;;;;;;;;;;;;;;;;
"431,$timmt $o (Stimmt So),""['Area Majority / Influence', 'Hand Management', 'Open Drafting', 'Set Collection']"",""['Arabian', 'Card Game', 'City Building', 'Economic', 'Humor', 'Medieval']"",""Alhambra: The Card Game is a game that both inspired and was named after the more popular, award-winning game and franchise, Alhambra.<br/><br/>This game has been released in several different versions, with the same core rules but different themes. The 2010 release of the game re-themed what was then called Stimmt So! to Alhambra: The Card Game, after the popular Game: Alhambra franchise and related, award-winning game Alhambra.  Alhambra, is itself derived from Stimmt So!. The original version of the game, Al Capone, was published in 1992 by a self-publishing company, db-Spiele, which was owned by the game designer Dirk Henn.<br/><br/>The re-theming of Stimmt So! and Alhambra: The Card Game resulted in the same game with different themes and only minor differences. Changes between Stimmt So! to Alhambra: The Card Game include:<br/>1) The initial money rules from Alhambra are used.<br/>2) The 2 player variant rules from Alhambra are used.<br/><br/>Stimmt So! A description of this version:<br/>Using mechanics similar to Union Pacific or its predecessor, Airlines, this game is about acquiring stock interests in the various aspects of a large corporation.  There are six <br/>different types of stock, which will reward the majority and sometimes the minority stockholders throughout the game.  Stock is made available by drawing cards on a four-card queue.  Each of the positions on the queue is a different stock market, which means there are four different currencies (Dollar, Euro, Ruble, Yen).  The currency cards are drawn from another queue on the same board.  A turn is quite simple - either take one of the four available currency cards or use some of your currency cards to purchase one of the available stocks.  If you pay more than the amount indicated on the stock card, the excess is lost.  However, if you purchase the stock for the exact printed price, then you can buy another stock, and so on.  After two randomly distributed payouts, the game ends with a final payout with the final stock card.  The player with the highest payout point total is the winner.<br/><br/>Al Capone  A description of this version:<br/>Using Influence cards, you collect Trade cards from different areas of town under the Mafia control, giving you control over the Distillery, the Chinese Laundry, the Betting Shop, etc. If you spend the exact amount of Influence required, you get another turn, and so on. Scoring occurs randomly twice during the game and at the end. When the first scoring occurs, only the majority holder in each Trade scores. When the second scoring occurs, the first and second majority holders score, and at the final scoring, the first three majority holders score. Ties are split accordingly.<br/><br/>Other versions/re-themes:<br/>Alhambra Bonn card game is Alhambra the card game with the Bonn theme. Originally as a limited run for Bonn, Germany and surrounding areas. There is also a Alhambra New York card game which is currently out of print, as well as an Alhambra Nederland card game. The re-themes are collectors items that people like to collect.<br/><br/>Player Counts:<br/>Earlier versions typically had a player count of 3-6 players while more recent versions, such as New York, is listed as 2-6 players.<br/><br/>"",1992,,,";;;;;;;;;;;;;;;;;;;;;;;;;;;;;;;;;;;;;;;;;;;;;;;;;;;;
"432,!شیش قلو,""['Hand Management', 'Score-and-Reset Game', 'Simultaneous Action Selection']"",""['Card Game', 'Number']"",""In 6 nimmt!, a.k.a. Category 5 and many other names, you want to score as few points as possible.<br/><br/>To play the game, you shuffle the 104 number cards, lay out four cards face-up to start the four rows, then deal ten cards to each player. Each turn, players simultaneously choose and reveal a card from their hand, then add the cards to the rows, with cards being placed in ascending order based on their number; specifically, each card is placed in the row that ends with the highest number that's below the card's number. When the sixth card is placed in a row, the owner of that card claims the other five cards and the sixth card becomes the first card in a new row.<br/><br/>In addition to a number from 1 to 104, each card has a point value. After finishing ten rounds, players tally their score and see whether the game ends. (Category 5 ends when a player has a score greater than 74, for example, while 6 nimmt! ends when someone tops 66.) When this happens, the player with the fewest points wins!<br/><br/>6 nimmt! works with 2-10 players, and the dynamics of gameplay change the more players that you have. One variant for the game has you use 34 cards, 44 cards, 54 cards, etc. (instead of all 104 cards) when you have three, four, five, etc. number of players. This change allows you to know which cards are in play, thereby allowing you to track which cards have been played and (theoretically) make better choices as to which card to play when.<br/><br/>"",1994,,,";;;;;;;;;;;;;;;;;;;;;;;;;;;;;;;;;;;;;;;;;;;;;;;;;;;;
"433,Shark,""['Commodity Speculation', 'Dice Rolling', 'Stock Holding']"",['Economic'],""Shark is a stock-trading game slightly reminiscent of Acquire in that abstract play on the game board determines the share values of the various companies.  The similarities end there, though, as Shark is more free-wheeling than Acquire.<br/><br/>At the start of your turn, you can buy shares (up to five) and sell shares (as many as you want), then you roll dice to determine which of the four company markers you place on the board and in which region. A company marker on its own doesn't contribute to the value of a company; only groups of at least two markers count, so groups of 5, 4, 1, and 1 markers would create a value of $9,000 for each of that company's shares. If you place a marker that combines those two lone markers, then you'd have groups of 5, 4, and 3, so the share price would shoot to $12,000. If you placed that marker on its own, the share price wouldn't change. When you place a marker, you gain money equal to that company's new share price, so you have an incentive to boost a company's size &mdash; but all players receive funds equal to the difference between the old share price and new for each share they hold, so are you enriching them more than yourself?<br/><br/>Of course, you can also place a marker to tank a company's share price. When a company's group expands to touch a smaller group, that smaller group is removed from the board, lowering the value of that company's shares (as long as the group had at least two markers) and costing everyone money equal to the loss in value. (Groups of equal size cannot touch, and you cannot place a marker to force a smaller group to touch a larger one.) To end your turn, you can again sell as many shares as you want and buy shares up to the per-turn limit of five.<br/><br/>Removed markers are banished from the game, not returned to the supply. Once all of a company's markers have been used, or a company's share price reaches $15,000, or all of the shares have been sold, the game ends, and players cash out all their shares to see who has the most money.<br/><br/>"",1987,,,";;;;;;;;;;;;;;;;;;;;;;;;;;;;;;;;;;;;;;;;;;;;;;;;;;;;
"434,Yucata',""['Hand Management', 'Race', 'Set Collection']"",""['Abstract Strategy', 'Card Game']"",""Simple movement game themed on Mayan graphics. Players have 7 cards (numbered 1-5 and 2 actions) and leapfrog their stone down the track. There are initial stones laid on the track and you collect them as you pass. According to their color, you throw stones away at the end, most stones left wins. The game has different variants of the initial layout.<br/><br/>Online Play<br/><br/><br/>     Yucata (turn-based)<br/><br/><br/>"",1996,,,";;;;;;;;;;;;;;;;;;;;;;;;;;;;;;;;;;;;;;;;;;;;;;;;;;;;
435,,[],[],,,,,;;;;;;;;;;;;;;;;;;;;;;;;;;;;;;;;;;;;;;;;;;;;;;;;;;;;
"436,Canyon,""['Betting and Bluffing', 'Grid Movement', 'Predictive Bid', 'Trick-taking']"",""['American West', 'Card Game', 'Racing']"",""Canyon is a trick-taking game in which players try to predict exactly how many tricks they will take.  The number of cards in a hand increases and then decreases in size.  A correct prediction gives your marker movement points around a scoring track depicted on a river in a canyon, whose main feature of interest is a section of &quot;rapids&quot; near the finish line where your marker will be &quot;caught in the current&quot; and sent back a few spaces if you go too many hands without a correct prediction.<br/><br/>Re-implements:<br/><br/>    Bid & Bluff<br/><br/><br/>Expanded by:<br/><br/>    Grand Canyon<br/><br/><br/>"",1997,,,";;;;;;;;;;;;;;;;;;;;;;;;;;;;;;;;;;;;;;;;;;;;;;;;;;;;
"437,Labirinto Magico Master,""['Map Deformation', 'Modular Board', 'Point to Point Movement']"",""[""""Children's Game"""", 'Fantasy', 'Maze', 'Puzzle']"",""This earlier Master Labyrinth is very different than the 2007 dragon-themed Master Labyrinth.<br/><br/>Part of the Ravensburger Labyrinth Games series, this game is based on the simpler, original Labyrinth game. It is played on a board with maze tiles (straight, L, and T shaped corridors) randomly arranged on it.  Players are represented on the board by little wizard pawns.  Players are wizards-in-training, and they are charged with exploring the maze and finding all the ingredients (numbered chips) needed to become a Wizard.  The trick is that chips must be claimed in numerical order.  Perhaps the most novel aspect of this game is that players mutate the maze by sliding a tile onto the board from the side, which hopefully will enable them to travel to the next ingredient.  Once all twenty-one items have been claimed, the highest total score wins, but each player also holds a secret recipe worth bonus points if they were able to capture three specific ingredients.<br/><br/>"",1991,,,";;;;;;;;;;;;;;;;;;;;;;;;;;;;;;;;;;;;;;;;;;;;;;;;;;;;
"438,Fantom,""['Hidden Movement', 'Point to Point Movement', 'Secret Unit Deployment', 'Team-Based Game']"",""['Deduction', 'Travel']"",""In Scotland Yard, one of the players takes on the role of Mr. X. His job is to move from point to point around the map of London taking taxis, buses or subways. The detectives &ndash; that is, the remaining players acting in concert &ndash; move around similarly in an effort to move into the same space as Mr. X. But while the criminal's mode of transportation is nearly always known, his exact location is only known intermittently throughout the game.<br/><br/>The 125 fare tickets are 5 black, 23 pink underground, 43 green bus,  54 yellow taxi.<br/><br/>Similar to<br/><br/>    The Fury of Dracula<br/>    Clue: The Great Museum Caper<br/>    Ghost Chase<br/>    Letters from Whitechapel<br/>    Garibaldi: The Escape<br/><br/><br/>"",1983,,,";;;;;;;;;;;;;;;;;;;;;;;;;;;;;;;;;;;;;;;;;;;;;;;;;;;;
439,,[],[],,,,,;;;;;;;;;;;;;;;;;;;;;;;;;;;;;;;;;;;;;;;;;;;;;;;;;;;;
"440,Zoff in Buffalo,['Simultaneous Action Selection'],""['American West', 'Farming']"",""Once a year, Buffalo City goes beef crazy. Cowboys drive their cows here to the biggest auction in the Wild West. The players must attempt to find grazing for their cows on the limited pasture.<br/><br/>Which beef baron will most cleverly play his cards?<br/><br/>Players have 10 cards to play which specify a number of cows.  Each round features a simultaneous selection of 2 of the 10 cards and a designation of which of the several pastures (the number of pastures in the game depends on the number of players) you'll try to place the cows in.  The tricky part starts with the rule that no two players can ever have exactly the same number of cows in a given pasture.  So if you plan to put 4 cows in a certain pasture, but somebody else has exactly 4 there already when your turn comes around, you'll only get to put 3 of them in -- and if somebody else has exactly 3 there already, you'll only get to put 2 of them in.  And it's very detrimental to your gameplan if you don't get to play all the cows you're entitled to!<br/><br/>When a pasture is completely filled with cows, there are bonuses paid in the form of a chance to put extra cows into other pastures, but perversely, the better bonuses go to the players with the second or third most cows, not the first most.  This is the *really* tricky part.<br/><br/>The game ends after five swift rounds and all 10 of your cards played, maybe half an hour from start to finish. Whoever has the most cows in the pastures wins!<br/><br/>"",1998,,,";;;;;;;;;;;;;;;;;;;;;;;;;;;;;;;;;;;;;;;;;;;;;;;;;;;;
"441,Filthy Rich,['Dice Rolling'],['Economic'],""Filthy Rich is a card game that is played with a binder and 4 pages of Ultra Pro card protector pages.  Players launch business billboards in the form of cards that get placed in the pages.  If the number rolled on the business dice corresponds to your billboard you get paid.  Income is spent to acquire Luxuries, and the first player to own three luxuries wins!  However, Luxuries and Businesses have a tax value that is due during a randomly-triggered tax phase.  if you cannot pay your taxes, you must liquidate your empire.  Special action cards and events add to this light but fun game.<br/><br/>"",1998,,,";;;;;;;;;;;;;;;;;;;;;;;;;;;;;;;;;;;;;;;;;;;;;;;;;;;;
"442,Campionato Italiano,""['Hand Management', 'Roll / Spin and Move']"",""['Racing', 'Sports']"",""Translating as &quot;By the Width of a Tire,&quot; this game covers a Tour de France-type of bicycle race.  Each player takes control of a four-member racing team, and the goal is to score as many points as possible for the whole team.  Movement is primarily handled by dice, however a limited card set partially replaces die results.  Once you add unique rules which allow riders to draft one another and multiple kinds of road surfaces, this game has much to offer race fans.<br/><br/>Homas Tour is the original edition of the cycle racing game later known as Um Reifenbreite. Many copies of the original game were destroyed in a warehouse fire in 1979. The combination of its sudden rarity and recognition as a good game meant that Homas Tour was (and is) very desirable, particularly to collectors. Everyone else can save their money and enjoy Um Reifenbreite!<br/><br/>"",1979,,,";;;;;;;;;;;;;;;;;;;;;;;;;;;;;;;;;;;;;;;;;;;;;;;;;;;;
"443,Code 7,['Paper-and-Pencil'],""['Deduction', 'Puzzle']"",""The clever little game Code 777 combines the elements of a good, logical deduction game and Indian poker. Each player receives a rack for keeping three tiles drawn from a pool of tiles, which are seven different numbers in seven different colors (28 tiles in total); however, the rack is turned away from you. When players sit in a circle, each player can see everyone else's tiles, except their own. Each turn, players draw a card with a question like, &quot;Do you see more yellow sevens or more blue sevens?&quot; which should help the others determine their tiles. Once you're reasonably sure of which tiles you have in front of you, you can take a guess &mdash; but if you're wrong, you have to start over with a fresh set of tiles ...<br/><br/>Code 777 was explicitly inspired by What's That on My Head?, and Alex Randolph credited Robert Abbott with co-designing this game based on that inspiration.<br/><br/>In 2010, Stronghold Games released Code 777: 25th Anniversary Deluxe Edition, adding both a fifth player to the game and symbols to make it colorblind-friendly. In 2015, Stronghold Games released Code 777: 30th Anniversary Limited Edition, which is the final edition from Stronghold Games.<br/><br/>In 2015 DiceTree Games released a multi-lingual edition of the game.<br/><br/>Similar to:<br/><br/>    What's That on My Head?<br/>    Egghead<br/>    Figure It<br/>    Amnesia<br/>    Guess What I Am!<br/>    Coyote<br/>    Pow Wow<br/>    Am I a Banana?<br/>    What's That on My Head?<br/><br/><br/>"",1985,,,";;;;;;;;;;;;;;;;;;;;;;;;;;;;;;;;;;;;;;;;;;;;;;;;;;;;
"444,Escape from the Hidden Castle,""['Dice Rolling', 'Push Your Luck', 'Race', 'Roll / Spin and Move', 'Track Movement']"",""[""""Children's Game""""]"",""Although billed as a children's game, Escape from the Hidden Castle, a.k.a. Midnight Party or Hugo, is actually quite enjoyable by adults as a light, fun game. Each player controls a number of guests at a party, with the number of guests dependent on the number of players. These guests start the round in the spaces of the gallery on the game board, one guest per space; this initial placement is a large part of a player's strategy.<br/><br/>The Phantom (or &quot;Hugo the ghost&quot; in earlier versions) starts in the cellar, then climbs the stairs towards the gallery where the guests circle. The mechanism for the Phantom's movement is simple: On a player's turn, he rolls a special die. If he gets a number, he moves his pieces; if he gets a Phantom, the Phantom moves. This means that with more players in the game, the Phantom moves a lot more frequently, so you must adjust your strategy accordingly.<br/><br/>Once the Phantom has reached the gallery, the guests can start ducking into rooms adjoining the gallery to avoid him, with only one guest per room! A couple of rooms are special in that they add or subtract extra &quot;fright points&quot; from your score. As the Phantom catches up with the remaining guests, they are sequestered on the stair steps, then in the cellar. The first guest caught &quot;earns&quot; the most fright points, with those caught later in the round earning less and less.<br/><br/>Once all the guests have been caught, the fright points are tallied. After playing a predetermined number of rounds, the player with the fewest fright points wins!<br/><br/>"",1989,,,";;;;;;;;;;;;;;;;;;;;;;;;;;;;;;;;;;;;;;;;;;;;;;;;;;;;
"445,Die Oster Insel,['Open Drafting'],['Racing'],""A simple game. Race to the end of a path. On your turn, you must move one figure and place as many rocks in the heads of other figures as the number of spaces you moved. Of the first two finishers, the one with the most rocks in his head wins.<br/><br/>The pieces are big honking Moai (Easter Island Statues) heads made of plastic which are hollow. The game is short and simple. There is not a huge amount of strategy and it helps if the other players cannot remember how many rocks are in the others heads.<br/><br/>"",1994,,,";;;;;;;;;;;;;;;;;;;;;;;;;;;;;;;;;;;;;;;;;;;;;;;;;;;;
"446,Astroslide,[],""['Abstract Strategy', 'Action / Dexterity', """"Children's Game""""]"",""Players take turns dropping their marbles down the channels of the game, trying to get as many marbles as possible to fall out the bottom.  Impeding the motion of the marbles are several plastic gates.  The gates catch the first marble that hits their top (subsequent marbles roll off) and swing back and forth when a marble hits their base.  Using logic, players deduce which way the gates will move when they drop their marble, and try to make a move that results in the most marbles making it to the bottom of the game (or that blocks a potentially good move by their opponent).<br/><br/>"",1965,,,";;;;;;;;;;;;;;;;;;;;;;;;;;;;;;;;;;;;;;;;;;;;;;;;;;;;
447,,[],[],,,,,;;;;;;;;;;;;;;;;;;;;;;;;;;;;;;;;;;;;;;;;;;;;;;;;;;;;
448,,[],[],,,,,;;;;;;;;;;;;;;;;;;;;;;;;;;;;;;;;;;;;;;;;;;;;;;;;;;;;
"449,Ballon Fiesta,['Dice Rolling'],""['Aviation / Flight', 'Racing']"",""This is a light game -- lighter than air, one might even say -- in which each player starts the game with a card assigning a secret interest in three different balloons.  The balloon markers are lovely little brightly colored plastic gadgets, and on your turn you roll a die and choose which of the eight you want to move.  Some spots you land on give you a free roll; from some you can only go backwards.  With much shucking and jiving the balloons gradually float and bump up toward the finish line whilst players feign disinterest in their own colors in hopes they'll be promoted by others.  When all three of your balloons reach the finish, you can claim victory.<br/><br/>"",1991,,,";;;;;;;;;;;;;;;;;;;;;;;;;;;;;;;;;;;;;;;;;;;;;;;;;;;;
"450,Octi,""['Grid Movement', 'Square Grid']"",['Abstract Strategy'],""Octi is a unique abstract strategy game.   Its object is to move your pieces into your opponent's starting points.  Octi  allows for multiple jumping, capturing, and special movement of pieces.  On each move players decide whether to bring in new pieces, upgrade their existing pieces, or move a piece.  The choices in this game are staggering and each move presents and entire new way of thinking about the game.  There is a 4 player teams variant that is included in the rules.<br/><br/>"",1999,,,";;;;;;;;;;;;;;;;;;;;;;;;;;;;;;;;;;;;;;;;;;;;;;;;;;;;
"451,Beutelschneider,['Trick-taking'],['Card Game'],""Translated as Cutpurse, this is a fairly unique entry in the trick-taking genre.  Three of the suits are relatively normal, however, the cards that are worth points, in the form of gold coins, have the least value.  The special thing about this game is the trump suit, which could have the Assassin killing the King or the Adventurer seducing the Countess; the character interaction is very interesting aspect.<br/><br/>"",1997,,,";;;;;;;;;;;;;;;;;;;;;;;;;;;;;;;;;;;;;;;;;;;;;;;;;;;;
"452,Mummy Rummy,['Set Collection'],['Card Game'],""from a session report:<br/><br/>This is a rummy based game where you are trying to form sets of Egyptian artifacts, three cards to a set, from a deck of about 50 cards. The quirk here is some cards have two images on them, so they could belong to one of two sets. You score for sets, and deduct points for cards left in the hand.<br/><br/>"",1994,,,";;;;;;;;;;;;;;;;;;;;;;;;;;;;;;;;;;;;;;;;;;;;;;;;;;;;
"453,Bohnanza: La Isla Bohnitâ,""['Hand Management', 'Set Collection', 'Trading']"",""['Card Game', 'Expansion for Base-game', 'Farming', 'Nautical', 'Negotiation', 'Pirates']"",""This is an expansion for the Bohnanza card game.  Included in this game is Uwe's farcical answer to Klaus Teuber's Seafarers expansion for Settlers of Catan.  Players are given the option of buying ships to help facilitate bean trading and selling.  Additionally, pirate ships are available, which can be used to raid your opponents' beans while in transit.<br/><br/>La Isla Bohnit&acirc; is part of the Bohnanza family of games.<br/><br/>Expands<br/><br/>    Bohnanza<br/><br/><br/>"",1998,,,";;;;;;;;;;;;;;;;;;;;;;;;;;;;;;;;;;;;;;;;;;;;;;;;;;;;
"454,Tante Tarantel,""['Point to Point Movement', 'Roll / Spin and Move']"",""['Animals', """"Children's Game""""]"",""Tante Tarantel (Auntie Tarantula) scoots round her web, gobbling up your insects as they try to escape. The web is a spiral, you roll the die and move Auntie, then take turns to move one of your bugs towards the exit space. Initially, Auntie is in a good mood, if she runs into a bug or bugs, they go back to her larder. But as soon as someone escapes, she loses her temper and kills anything she catches! The game has a scoring track, and each time a bug is caught or escapes, a marker moves up, also adding a number to the die roll. So Auntie runs around the web faster and faster. Players can share some spaces, but most of the time, bump each other back and forth. Naturally, nasty bugs push others into Aunty's path to certain death!<br/> Slightly confusing when you start, this is actually a really simple game, easily as good as any D&amp;F game. The original set had wooden pawns for the bugs, but D&amp;F issued a series of neat rubber bugs, which do add to the games' style.<br/><br/>"",1991,,,";;;;;;;;;;;;;;;;;;;;;;;;;;;;;;;;;;;;;;;;;;;;;;;;;;;;
